Property,Alternate Name,Description,Address,Historic District,Construction Date,the_geom,Longitude,Latitude,Photo,Images,Additional Information
Little Rock Arsenal,Mcarthur Military Museum,"The Arsenal Building at 503 E 9th was built in 1840 and served as such until 1861.  After the Civil War, it provided housing for soldiers and their families.   General Douglas MacArthur, the supreme allied commander of the Southwest Pacific Theater during World War II, was born at the arsenal in 1880.  After being closed as a military base, the land was deeded to the City for use as a park in perpetuity.  The structure was listed on the National Register of Historic Places on 7/28/1970.",503  E 9th,Macarthur Park Historic District,1840,POINT (-92.265337389869 34.73839175284),-92.26533739,34.73839175,https://maps.littlerock.gov/webapps/LR_Historic_Sites/Data/PU3150/PU3150.jpg,https://maps.littlerock.gov/webapps/LR_Historic_Sites/Data/PU3150/Images/phpslideshow.php,https://maps.littlerock.gov/webapps/LR_Historic_Sites/Data/PU3150/PU3150_ai.pdf
Lamb-Mcswain House,,"The Lamb-McSwain House, located at 2124 Rice Street, is a Craftsman Bungalow style house. Listed in the National Register of Historic Places in 6/4/1998, it was constructed in 1926 by John W. Lamb, the owner, and Ellard Lamb, his brother,  from mail order blue prints from Ye Planry Architects of Dallas, Texas.  This one-story, brick home was later owned by Lamb’s daughter, Bernice Lamb McSwain.  A gabled roof, detailed with exposed rafters and a brick chimney, caps the house.",2124  S Rice,,1926,POINT (-92.301054410863 34.728982251453),-92.30105441,34.72898225,https://maps.littlerock.gov/webapps/LR_Historic_Sites/Data/PU9974/PU9974.jpg,https://maps.littlerock.gov/webapps/LR_Historic_Sites/Data/PU9974/Images/phpslideshow.php,https://maps.littlerock.gov/webapps/LR_Historic_Sites/Data/PU9974/PU9974_ai.pdf
"Taylor, Samuel P Service Station",Audio-Visual Communications,The Samuel P. Taylor Service Station is located at the comer of Cross Street and West Third Street in downtown Little Rock. The building was constructed in 1938 on a lot previously owned by the Cross Street Christian Church where the church had partially built a building. John Saunders was hired to build a service station on the site. In 1938 the Samuel P. Taylor Service Station opened its doors to motorists.  The structure was listed on the National Register of Historic Places on 11/29/2000.,1123  W 3rd,,1938,POINT (-92.283641238893 34.747599200788),-92.28364124,34.7475992,https://maps.littlerock.gov/webapps/LR_Historic_Sites/Data/PU4619/PU4619.jpg,https://maps.littlerock.gov/webapps/LR_Historic_Sites/Data/PU4619/Images/phpslideshow.php,https://maps.littlerock.gov/webapps/LR_Historic_Sites/Data/PU4619/PU4619_ai.pdf
Confederate Soldier's Monument,,"The Confederate Soldiers Monument is also known as “Defense of the Flag” and the “Arkansas Sons of the Confederacy Memorial”. The bronze soldier was created by Fredrick Ruckstuhl.  The bronze angel stands barefoot on a sphere at the top of the monument.  A. Durenne is also credited with work on the monument. It was built in 1905.  It was placed on the National Register of Historic Places on April 26, 1996.",400 Woodlane,,1905,POINT (-92.288099200793 34.747404774321),-92.2880992,34.74740477,https://maps.littlerock.gov/webapps/LR_Historic_Sites/Data/PU4768S/PU4768S.jpg,https://maps.littlerock.gov/webapps/LR_Historic_Sites/Data/PU4768S/Images/phpslideshow.php,https://maps.littlerock.gov/webapps/LR_Historic_Sites/Data/PU4768S/PU4768S_ai.pdf
Remmel Apartments,Remmel Duplex #1,"Designed in 1917 by Thompson and Harding, this apartment house is located on a narrow lot facing West 17th Street in Little Rock. It is the third Remmell Apartment house. It has a Craftsman architect style. The unit, although multi-family, has the appearance of a single-unit dwelling. The structure was listed on the National Register of Historic Places on 12/22/1982.",409  W 17th,Governor's Mansion Historic District,1917,POINT (-92.277545650256 34.732800989863),-92.27754565,34.73280099,https://maps.littlerock.gov/webapps/LR_Historic_Sites/Data/PU1272/PU1272.jpg,https://maps.littlerock.gov/webapps/LR_Historic_Sites/Data/PU1272/Images/phpslideshow.php,https://maps.littlerock.gov/webapps/LR_Historic_Sites/Data/PU1272/PU1272_ai.pdf
Prospect Terrace Apartments,,"The Prospect Terrance Apartments, located at 3603 Kavanaugh Boulevard, is an International style structure. Listed in the National Register of Historic Places in 1-9-2002, it was designed by architect Edwin B. Cromwell and constructed in 1947.  This three-story building has a brick façade and a flat roof to give it a modern look.  The apartment complex features a “U” shape design and is located in the Hillcrest neighborhood.",3601  Kavanaugh,,1947,POINT (-92.331796423346 34.762177242004),-92.33179642,34.76217724,https://maps.littlerock.gov/webapps/LR_Historic_Sites/Data/PU3317/PU3317.jpg,https://maps.littlerock.gov/webapps/LR_Historic_Sites/Data/PU3317/Images/phpslideshow.php,https://maps.littlerock.gov/webapps/LR_Historic_Sites/Data/PU3317/PU3317_ai.pdf
Little Rock High School,Central High School,"The Little Rock Central High School, at 1500 Park Street, is a Gothic Revival style structure. Listed in the National Register of Historic Places in 8/19/77, it was designed by architects George R. Mann, Eugene John Stern, John Parks Almand, George H. Wittenberg, and Lawson L. Delony and constructed in 1927.  The four-story brick building was the famous site of integration where nine black children were enrolled in a white high school after “Brown vs. Board of Education” outlawed separate but equal. On 5/20/1982, it was listed as a National Historic Landmark.",1500  S Park St,Central High School Neighborhood Historic District,1927,POINT (-92.298819123744 34.736847475671),-92.29881912,34.73684748,https://maps.littlerock.gov/webapps/LR_Historic_Sites/Data/PU3240/PU3240.jpg,https://maps.littlerock.gov/webapps/LR_Historic_Sites/Data/PU3240/Images/phpslideshow.php,https://maps.littlerock.gov/webapps/LR_Historic_Sites/Data/PU3240/PU3240_ai.pdf
Terminal Warehouse Building,,The Terminal Warehouse Building (now known as the Markham Tower East) is in the area of downtown Little Rock that was the city’s warehouse and manufacturing center. The building was built in 1926 and designed by architect Eugene Stern in the Venetian Gothic style.  The building is extremely broad with an eight story elaborate towner in the center of the south façade.  The structure was listed on the National Register of Historic Places on 4/29/1982.,500  President Clinton,,1926,POINT (-92.264695713846 34.747666232092),-92.26469571,34.74766623,https://maps.littlerock.gov/webapps/LR_Historic_Sites/Data/PU3164/PU3164.jpg,https://maps.littlerock.gov/webapps/LR_Historic_Sites/Data/PU3164/Images/phpslideshow.php,https://maps.littlerock.gov/webapps/LR_Historic_Sites/Data/PU3164/PU3164_ai.pdf
Johnson House #1,Cromwell Court Apartments,"The Johnson House, now known as part of the Cromwell Court Apartments, located at 514 East 8th Street, is a Colonial Revival style house. Listed in the National Register of Historic Places in 12/22/1982, it was designed by noted architect Charles L. Thompson and constructed in 1900.  This house is one of the three rent houses on this street that he designed.  A hipped roof with a centered dormer tops this two-story weatherboard house. A covered porch sustained by Ionic pillars frames the front entrance to the house.",514  E 8th,Macarthur Park Historic District,1900,POINT (-92.266301218253 34.740774030963),-92.26630122,34.74077403,https://maps.littlerock.gov/webapps/LR_Historic_Sites/Data/PU2840/PU2840.jpg,https://maps.littlerock.gov/webapps/LR_Historic_Sites/Data/PU2840/Images/phpslideshow.php,https://maps.littlerock.gov/webapps/LR_Historic_Sites/Data/PU2840/PU2840_ai.pdf
Little Rock City Hall,,"The Little Rock City Hall, at 500 Markham Street, is a Renaissance Revival style structure. Listed in the National Register of Historic Places in 10/18/1979, it was designed by renowned architect Charles L Thompson and constructed in 1907.  City Hall was built to be a symbol of refinement and is one of the city’s most historic government buildings.  In 1960, the building was remodeled which included lowering the ceilings and bricking in the windows.  The late 1980s remodel reversed that with windows that are similar to the original.",500  W Markham,,1907,POINT (-92.275551929329 34.749085961528),-92.27555193,34.74908596,https://maps.littlerock.gov/webapps/LR_Historic_Sites/Data/PU3239/PU3239.jpg,https://maps.littlerock.gov/webapps/LR_Historic_Sites/Data/PU3239/Images/phpslideshow.php,https://maps.littlerock.gov/webapps/LR_Historic_Sites/Data/PU3239/PU3239_ai.pdf
Dunbar Jr & Sr High School & Junior College,Dunbar Magnet Middle School,"The Dunbar Junior and Senior High School and Junior College, also known as Dunbar High School, located on the corner of Wright Avenue and Ringo, is an Art Deco style building built for African Americans during the era of segregation.  Listed in the National Register of Historic Places in 8/6/1980, it was designed by architects George H. Wittenberg and Lawson L. Delony and constructed in 1929.  Black teachers at this school fought for the same pay as the white teachers received which was resolved in 149 F. 2d 703 Morris v. Williams.",1100  Wright Ave,Paul Laurence Dunbar School Neighborhood Historic District,0,POINT (-92.286145773086 34.732394814065),-92.28614577,34.73239481,https://maps.littlerock.gov/webapps/LR_Historic_Sites/Data/PU3232/PU3232.jpg,https://maps.littlerock.gov/webapps/LR_Historic_Sites/Data/PU3232/Images/phpslideshow.php,https://maps.littlerock.gov/webapps/LR_Historic_Sites/Data/PU3232/PU3232_ai.pdf
Lafayette Hotel,,"The Lafayette Hotel was designed by St. Louis architect, George Barnett. The structure was listed on the National Register of Historic Places on 9/30/1982. The hotel opened in 1925.  Paul Heerwagen was the interior designer. Because of reduced business caused by the depression, the hotel had to close in 1933. John Oehrlie, a partner of Heerwagen’s, redesigned the interior of the hotel in 1941. In 1941 the hotel was able to reopen because of the need for hotel rooms due to World War II traveling. After several success years the hotel was no longer profitable and closed for a final time in 1973.",523  S Louisiana,Capitol-Main Historic District,1925,POINT (-92.272134058284 34.743511259755),-92.27213406,34.74351126,https://maps.littlerock.gov/webapps/LR_Historic_Sites/Data/PU0234/PU0234.jpg,https://maps.littlerock.gov/webapps/LR_Historic_Sites/Data/PU0234/Images/phpslideshow.php,https://maps.littlerock.gov/webapps/LR_Historic_Sites/Data/PU0234/PU0234_ai.pdf
Lake Nixon,,"Lake Nixon, located at 18500 Cooper Orbit Road, was listed in the National Register of Historic places on June 5, 2017.  Lake Nixon is a preserved example of a site associated with a national-level desegregation case, brought to the United States Supreme Court, that inevitably set the precedent for entertainment and recreation establishments to not be able to discriminate based on race, and were found to be subject to Title II of the 1964 Civil Rights Act.",18500 Cooper Orbit Rd,,,POINT (-92.433958570367 34.718446026188),-92.43395857,34.71844603,https://maps.littlerock.gov/webapps/LR_Historic_Sites/Data/PU10111/PU10111.jpg,https://maps.littlerock.gov/webapps/LR_Historic_Sites/Data/PU10111/Images/phpslideshow.php,https://maps.littlerock.gov/webapps/LR_Historic_Sites/Data/PU10111/PU10111_ai.pdf
Choctaw Route Station,,"The Choctaw Route Station is located at 101 E. 3rd St. and was built in 1899. It was listed in the National Register of Historic Places on 05-06-1975. It has the influence of Louis Henry Sullivan. The station belonged to the Oklahoma and Gulf Railroad. In 1902 the station was sold to Rock Island Railroad. In 2004, the station became part of the William Jefferson Clinton Presidential Library and Park.",1010 E 3rd,,0,POINT (-92.259057241959 34.745522880996),-92.25905724,34.74552288,https://maps.littlerock.gov/webapps/LR_Historic_Sites/Data/PU3139/PU3139.jpg,https://maps.littlerock.gov/webapps/LR_Historic_Sites/Data/PU3139/Images/phpslideshow.php,https://maps.littlerock.gov/webapps/LR_Historic_Sites/Data/PU3139/PU3139_ai.pdf
Croxson House,,"The Croxson House, at 1901 Gaines Street, is a Dutch Colonial style. Listed in the National Register of Historic Places in 12/22/1982, it was designed by distinguished architect Charles L. Thompson and constructed in 1908.  A clipped-gable roof is supported by five Tuscan columns that surround the front and side porch of this two story house.",1901  S Gaines,Governor's Mansion Historic District,1908,POINT (-92.280722495176 34.730596503304),-92.2807225,34.7305965,https://maps.littlerock.gov/webapps/LR_Historic_Sites/Data/PU1598/PU1598.jpg,https://maps.littlerock.gov/webapps/LR_Historic_Sites/Data/PU1598/Images/phpslideshow.php,https://maps.littlerock.gov/webapps/LR_Historic_Sites/Data/PU1598/PU1598_ai.pdf
Luxor Apartments,,"The Luxor Apartments, located at 1923 Main Street, is a Craftsman style building. Listed in the National Register of Historic Places in 4/7/1995, it was constructed in 1924 by Samuel J. Storthz, Sr., a well-known Arkansas businessman.  This brick, two-story was designed in the shape of a “U” and was at the time of construction, the largest apartment complex in the city with 28 apartments.  Living in this building was a sign of status when it was first built.  It came with newest appliances and even a doorman.",1923  S Main,South Main Residential Historic District,1924,POINT (-92.273252123746 34.729947969482),-92.27325212,34.72994797,https://maps.littlerock.gov/webapps/LR_Historic_Sites/Data/PU9993/PU9993.jpg,https://maps.littlerock.gov/webapps/LR_Historic_Sites/Data/PU9993/Images/phpslideshow.php,https://maps.littlerock.gov/webapps/LR_Historic_Sites/Data/PU9993/PU9993_ai.pdf
"Ward, Zeb Building",,"Constructed in 1881, the Zeb Ward Building, is an example of a late 19th Century commercial structure.  It is particularly noteworthy for its builder, Zeb Ward, who was lessee of the old Arkansas State Penitentiary. Ward built five houses on the south side of the block fronting West Second for his family members.  Three of the houses and three of the commercial building are extant; this 1881 structure being one of the most prominent. The structure was listed on the National Register of Historic Places on 4/19/1978.",1001  W Markham,,1881,POINT (-92.28127781338 34.74934478543),-92.28127781,34.74934479,https://maps.littlerock.gov/webapps/LR_Historic_Sites/Data/PU3255/PU3255.jpg,https://maps.littlerock.gov/webapps/LR_Historic_Sites/Data/PU3255/Images/phpslideshow.php,https://maps.littlerock.gov/webapps/LR_Historic_Sites/Data/PU3255/PU3255_ai.pdf
"Mitchell, James, School",,"The James Mitchell School, also known as Mitchell Elementary, located at 2410 South Battery Street, is a Prairie and Neoclassical Revival style building. Listed in the National Register of Historic Places in 5/20/2009, it was designed by architects Charles L. Thompson and Thomas Harding Jr., and constructed in 1908.  It was added onto five separate times.  This school, named after the editor-in-chief and president of the Arkansas Democrat Gazette James Mitchell, only contained four rooms originally.",2410  S Battery,Central High School Neighborhood Historic District,1915,POINT (-92.294821527319 34.725914349415),-92.29482153,34.72591435,https://maps.littlerock.gov/webapps/LR_Historic_Sites/Data/PU5243/PU5243.jpg,https://maps.littlerock.gov/webapps/LR_Historic_Sites/Data/PU5243/Images/phpslideshow.php,https://maps.littlerock.gov/webapps/LR_Historic_Sites/Data/PU5243/PU5243_ai.pdf
Cumberland Towers,,"Cumberland Towers, located at 311 E 8th, is an example of the federally funded senior citizen housing projects of the late mid twentieth century as initiated by the Housing Act of 1956.  It was designed by Wittenberg, Delony, & Davidson. and was listed in the National Register of Historic Places on March 7, 2017.",301  E 8Th,Macarthur Park Historic District,1974,POINT (-92.26886204977 34.740216318733),-92.26886205,34.74021632,https://maps.littlerock.gov/webapps/LR_Historic_Sites/Data/PU2843/PU2843.jpg,https://maps.littlerock.gov/webapps/LR_Historic_Sites/Data/PU2843/Images/phpslideshow.php,https://maps.littlerock.gov/webapps/LR_Historic_Sites/Data/PU2843/PU2843_ai.pdf
Stebbins & Roberts,,The Stebbins and Roberts Building was built in 1947 and was designed by H. Ray Burks and Bruce Roy Anderson.  It is an intact example of a post-war commercial and industrial building and the only industrial building designed by Burks and Anderson.  The structure was listed on the National Register of Historic Places on 10/4/2016.,1300  E 6th,,1936,POINT (-92.256043595916 34.742263154026),-92.2560436,34.74226315,https://maps.littlerock.gov/webapps/LR_Historic_Sites/Data/PU8389/PU8389.jpg,https://maps.littlerock.gov/webapps/LR_Historic_Sites/Data/PU8389/Images/phpslideshow.php,https://maps.littlerock.gov/webapps/LR_Historic_Sites/Data/PU8389/PU8389_ai.pdf
Halliburton House #1,,"Thought to serve as rental property, the Halliburton Houses are two identical houses built around 1905 and/or 1906. They are located on the corner of 16th and Center Street, Little Rock’s fashion center in those times. Tom Halliburton is believed to have built the houses. Sharing a corner lot and the same architectural style makes these historical structures significant.  The structure was listed on the National Register of Historic Places on 12/12/1976.",1601  S Center,Governor's Mansion Historic District,1905,POINT (-92.275402528082 34.733559431658),-92.27540253,34.73355943,https://maps.littlerock.gov/webapps/LR_Historic_Sites/Data/PU1149/PU1149.jpg,https://maps.littlerock.gov/webapps/LR_Historic_Sites/Data/PU1149/Images/phpslideshow.php,https://maps.littlerock.gov/webapps/LR_Historic_Sites/Data/PU1149/PU1149_ai.pdf
"Hardy, M. W. House",,"The Hardy House was constructed in 1921. It is a significant Thompson and Harding design due to its stylistic influence of an English Country House.  The dark brown brick house is composed ao a central block with two identical one-story wings.  The most prominent feature is the steep, compositional shingle gable roof which is shaped to resemble thatch.  The structure was listed on the National Register of Historic Places on 12/22/1982.",2400  S Broadway,,1921,POINT (-92.279149866997 34.725448035072),-92.27914987,34.72544804,https://maps.littlerock.gov/webapps/LR_Historic_Sites/Data/PU1426/PU1426.jpg,https://maps.littlerock.gov/webapps/LR_Historic_Sites/Data/PU1426/Images/phpslideshow.php,https://maps.littlerock.gov/webapps/LR_Historic_Sites/Data/PU1426/PU1426_ai.pdf
Little Rock Community Church,,"The First Church of Christ Scientist, also known as the Little Rock Community Church, located on the corner of 20th and Louisiana Street, is a Mission style structure. Listed in the National Register of Historic Places in 10/9/1986, it was designed by architect John Parks Almand and constructed in 1919.  This church building is ornately decorated with terra-cotta medallions and topped with a hipped, red tile roof.  The front entrance and side windows feature large, plaster arches supported by matching columns.",2000  S Louisiana,Governor's Mansion Historic District,1919,POINT (-92.275280599518 34.729616808423),-92.2752806,34.72961681,https://maps.littlerock.gov/webapps/LR_Historic_Sites/Data/PU1063/PU1063.jpg,https://maps.littlerock.gov/webapps/LR_Historic_Sites/Data/PU1063/Images/phpslideshow.php,https://maps.littlerock.gov/webapps/LR_Historic_Sites/Data/PU1063/PU1063_ai.pdf
"Jones, Scipio A House",,"The Scipio A. Jones House, located at 1872 South Cross Street, is a Bungalow style house. Listed in the National Register of Historic Places in 5/28/1999, it was constructed in 1928 for Scipio Africanus Jones.  This one-and-one-half story brick and stucco house was home to Jones, a powerful attorney for the black community in Arkansas.  Jones was one of the first black lawyers in Little Rock who won many appeal cases, which went to the United States Supreme Court, against wrongly convicted men.  Jones was also a prominent leader of the Arkansas Republican Party.",1872  S Cross,Paul Laurence Dunbar School Neighborhood Historic District,1928,POINT (-92.2872374096 34.731119486962),-92.28723741,34.73111949,https://maps.littlerock.gov/webapps/LR_Historic_Sites/Data/PU9832/PU9832.jpg,https://maps.littlerock.gov/webapps/LR_Historic_Sites/Data/PU9832/Images/phpslideshow.php,https://maps.littlerock.gov/webapps/LR_Historic_Sites/Data/PU9832/PU9832_ai.pdf
Hotze House,,"One of Little Rock’s most important historic buildings, the Hotze House was built in 1900.  Charles Thompson designed the house in a combination of Georgian Revival and Beaux Arts Classicism.  The structure was listed on the National Register of Historic Places on 8/11/1975.  Symbolic of the many European immigrants who settled in Arkansas, the Hotze House was built by one of Arkansas’ most successful and prominent businessman, Peter Hotze. His house is representative of his ability to bring both economic and cultural development to the city of Little Rock.",1619  S Louisiana,Governor's Mansion Historic District,1900,POINT (-92.274192672337 34.732817563558),-92.27419267,34.73281756,https://maps.littlerock.gov/webapps/LR_Historic_Sites/Data/PU1026/PU1026.jpg,https://maps.littlerock.gov/webapps/LR_Historic_Sites/Data/PU1026/Images/phpslideshow.php,https://maps.littlerock.gov/webapps/LR_Historic_Sites/Data/PU1026/PU1026_ai.pdf
Little Rock Us Post Office & Courthouse,,"The Little Rock U.S. Post Office and Courthouse, also known as the Little Rock U.S. Post Office and Federal Building, located at 600 West Capitol Avenue, is an excellent example of a Classical Revival style building. Listed in the National Register of Historic Places in 12/23/1999, it was designed by architects James A. Wetmore and Louis Simon and engineer F. M. Weakly.  Programs meant to help lower unemployment rates at the time of the Great Depression were created in this building.  This five-story building features a limestone façade and large Doric columns.",600  W Capitol,,1931,POINT (-92.27767326014 34.745456552478),-92.27767326,34.74545655,https://maps.littlerock.gov/webapps/LR_Historic_Sites/Data/PU9416/PU9416.jpg,https://maps.littlerock.gov/webapps/LR_Historic_Sites/Data/PU9416/Images/phpslideshow.php,https://maps.littlerock.gov/webapps/LR_Historic_Sites/Data/PU9416/PU9416_ai.pdf
"Lee, Robert E., School - Hinton Community Center",,"The Robert E. Lee School, also known as the Willie L. Hinton Neighborhood Resource Center, located at 3805 West 12th Street, is an Art Deco and Gothic Revival Style building. Listed in the National Register of Historic Places in 6/2/2009, it was designed by architects Frank Gibb, Theodore Sanders, and Thomas Harding, Jr., and was constructed in 1906 by Patrick Power.  This brick, two-story building was created in order to help educate the rapidly growing population of Little Rock.  The building was named after the city director, Willie L. Hinton.",3805  W 12th,,1906,POINT (-92.316236833778 34.740014668712),-92.31623683,34.74001467,https://maps.littlerock.gov/webapps/LR_Historic_Sites/Data/PU8452/PU8452.jpg,https://maps.littlerock.gov/webapps/LR_Historic_Sites/Data/PU8452/Images/phpslideshow.php,https://maps.littlerock.gov/webapps/LR_Historic_Sites/Data/PU8452/PU8452_ai.pdf
Gay Oil Co Building,,"The Gay Oil Building, located at 300 Broadway, is a two-story Early 20th Century Style Commercial building with neo-classical detailing.  It features terracotta on the ground floor and more elaborate frieze and cornice on the second floor.  It has a basement which was originally used for parking.  The Broadway façade features an entry to the second floor offices while the corner of the first floor originally functioned as a gas station.  ti was built in 1925 and designed by Wittenberg, Deloney and Watts, architects; N.B. Garver, engineer/designer; and constructed by Carter & Carter, contractors.   It was listed in the National Register of Historic places on June 5, 2017.",300  S Broadway,,1925,POINT (-92.275755910361 34.746657599512),-92.27575591,34.7466576,https://maps.littlerock.gov/webapps/LR_Historic_Sites/Data/PU4414/PU4414.jpg,https://maps.littlerock.gov/webapps/LR_Historic_Sites/Data/PU4414/Images/phpslideshow.php,https://maps.littlerock.gov/webapps/LR_Historic_Sites/Data/PU4414/PU4414_ai.pdf
Johnswood,,"The Johnswood House, located at 10314 Cantrell Road, is a Rustic and Colonial Revival style house. Listed in the National Register of Historic Places in 5/20/1994, it was designed by architect Maximilian F. Mayer and constructed in 1941.  This was home to John Gould Fletcher and Charlie May Simon, who were two of the most well-known writers from Arkansas.  Fletcher was an Imagist poet and his wife Simon was a novelist.   Fletcher won a Pulitzer prize in 1939 for his “Selected Poems”.  Simon was also the recipient of literary awards.",10314  Cantrell,,1941,POINT (-92.388236074626 34.7883802964),-92.38823607,34.7883803,https://maps.littlerock.gov/webapps/LR_Historic_Sites/Data/PU3234/PU3234.jpg,https://maps.littlerock.gov/webapps/LR_Historic_Sites/Data/PU3234/Images/phpslideshow.php,https://maps.littlerock.gov/webapps/LR_Historic_Sites/Data/PU3234/PU3234_ai.pdf
